{
  "$schema": "https://json-schema.org/draft/2020-12/schema",
  "$id": "https://codex-usage-tracker.invalid/schemas/lifecycle-path-authority-v1.schema.json",
  "title": "CK-07R1A0 lifecycle path authority",
  "type": "object",
  "additionalProperties": false,
  "required": [
    "schema",
    "authority_version",
    "owner",
    "authority_base_sha",
    "upstream_acceptance",
    "blocked_requalification",
    "reachable_path",
    "append_safe_small",
    "independent_truth",
    "postconditions",
    "run_authorization",
    "prior_attempts",
    "retained_evidence",
    "scope_additions",
    "dependencies",
    "fail_closed_rules"
  ],
  "properties": {
    "schema": {"const": "codex-usage-tracker.lifecycle-path-authority.v1"},
    "authority_version": {"const": 1},
    "owner": {"const": "CK-07R1A0"},
    "authority_base_sha": {"$ref": "#/$defs/gitSha"},
    "upstream_acceptance": {
      "type": "array",
      "minItems": 3,
      "maxItems": 3,
      "items": {
        "type": "object",
        "additionalProperties": false,
        "required": ["packet", "sha", "status"],
        "properties": {
          "packet": {"type": "string", "pattern": "^CK-[A-Z0-9]+(?:-[A-Z0-9]+)*$"},
          "sha": {"$ref": "#/$defs/gitSha"},
          "status": {"const": "accepted_merged_exact_main_verified"}
        }
      }
    },
    "blocked_requalification": {
      "type": "object",
      "additionalProperties": false,
      "required": ["packet", "status", "reason", "accepted_receipt_required"],
      "properties": {
        "packet": {"const": "CK-07R1"},
        "status": {"const": "BLOCKED"},
        "reason": {"const": "planner_valid_lifecycle_receipt_and_this_authority"},
        "accepted_receipt_required": {"const": true}
      }
    },
    "reachable_path": {
      "type": "object",
      "additionalProperties": false,
      "required": ["startup_recovery", "planner", "small_publication", "ordering", "forbidden_shortcuts", "identity_binding"],
      "properties": {
        "startup_recovery": {
          "type": "array",
          "const": [
            "select_readable_artifact(pointer_path, validate_open=...)",
            "recover_startup(pointer_path, selection=..., store=..., ...)"
          ]
        },
        "planner": {
          "type": "array",
          "const": [
            "plan_refresh(changes, intent, limits=..., dirty_keys=..., projection_rows=..., expected_wal_bytes=...)"
          ]
        },
        "small_publication": {
          "type": "array",
          "const": [
            "PublicationWriter.publish_with_pointer(plan, request, write_set, pointer_path=..., operational_store=..., pointer_request=..., validate_open=...)",
            "publish_small_with_pointer(..., commit_analytical=...)",
            "PublicationWriter.publish(plan, request, write_set)"
          ]
        },
        "ordering": {"const": "recovery_read_first; planner_before_writer_lock; selected_plan_unchanged_through_writer"},
        "forbidden_shortcuts": {
          "type": "array",
          "const": [
            "manually_constructed_PublicationPlan",
            "manual_OperationClass_APPEND_SAFE_SMALL_override",
            "direct_PublicationWriter_publish_without_plan_refresh",
            "publication_receipt_without_reachable_recovery_path"
          ]
        },
        "identity_binding": {
          "type": "object",
          "additionalProperties": false,
          "required": ["same_publication_identity", "mismatch_result"],
          "properties": {
            "same_publication_identity": {
              "type": "array",
              "const": [
                "ReadSelection.head.publication_id == RefreshIntent.parent_publication_id",
                "RefreshIntent.parent_publication_id == PublicationPlan.parent_publication_id",
                "PublicationPlan.parent_publication_id == SmallPublicationRequest.expected_active_publication_id",
                "SmallPublicationRequest.expected_active_publication_id == pre_commit_pointer.active.publication_id",
                "committed_AnalyticalHead.parent_publication_id == SmallPublicationRequest.expected_active_publication_id",
                "post_commit_pointer.active.publication_id == committed_AnalyticalHead.publication_id"
              ]
            },
            "mismatch_result": {"const": "fail_closed_before_acceptance_no_stitched_artifacts_or_cross_run_identity_binding"}
          }
        }
      }
    },
    "append_safe_small": {
      "type": "object",
      "additionalProperties": false,
      "required": ["operation_class", "selection_reason", "selection_conditions", "breach_result", "writer_identity_rule"],
      "properties": {
        "operation_class": {"const": "append_safe_small"},
        "selection_reason": {"const": "all_small_tail_bounds_proven"},
        "selection_conditions": {
          "type": "array",
          "const": [
            "no_schema_adapter_identity_normalization_or_projection_compatibility_change",
            "no_no_change_history_expand_source_replace_or_valuation_only_classification_applies",
            "estimate_change_set_has_no_limit_breaches_under_the_supplied_TailLimits",
            "the_selected_sources_and_refresh_intent are the inputs to plan_refresh"
          ]
        },
        "breach_result": {"const": "any_limit_breach_selects_append_safe_large_and_small_writer_rejects_it"},
        "writer_identity_rule": {"const": "the_plan_returned_by_plan_refresh_is passed unchanged to the pointer-coordinated writer"}
      }
    },
    "independent_truth": {
      "type": "object",
      "additionalProperties": false,
      "required": ["oracle_path", "oracle_symbol", "derivation", "forbidden_sources", "comparisons"],
      "properties": {
        "oracle_path": {"const": "tests/agent_kernel/contracts/reference/lifecycle.py"},
        "oracle_symbol": {"const": "fold_lifecycle"},
        "derivation": {"const": "derive ordered transition vectors from synthetic observations plus prior transitions, then compare lifecycle identities, versions, folds, counts, and digests"},
        "forbidden_sources": {
          "type": "array",
          "const": [
            "codex_usage_tracker.agent_kernel.publication.preparation",
            "codex_usage_tracker.agent_kernel.publication.planner",
            "codex_usage_tracker.agent_kernel.publication.writer",
            "codex_usage_tracker.agent_kernel.publication.recovery",
            "SQLite rows as expected answers"
          ]
        },
        "comparisons": {
          "type": "array",
          "const": ["transition_identity_and_version", "fold_identity_and_digest", "publication_counts_and_chain"]
        }
      }
    },
    "postconditions": {
      "type": "object",
      "additionalProperties": false,
      "required": ["publication", "recovery", "required_receipt_fields"],
      "properties": {
        "publication": {
          "type": "array",
          "const": [
            "publication_head is the final direct child and every parent_publication_id is the preceding head",
            "source_occurrences equals inserted_occurrences with no duplicate occurrence identities",
            "lifecycle transition/entity counts and fold digest equal independent truth",
            "preparation transaction is closed before the writer begins and no analytical transaction remains open",
            "artifact manifest, operation_id, publication_id, schema identity, and pointer head agree"
          ]
        },
        "recovery": {
          "type": "array",
          "const": [
            "select_readable_artifact validates the active artifact and falls back only to a validated rollback artifact",
            "recover_startup runs only after readable selection and reconciles pending intents, stale leases, and dead jobs",
            "pointer generation, active publication, analytical head, and recovery intent identities agree after reconciliation",
            "a crash/retry is idempotent and does not duplicate or silently replace a publication",
            "owned artifacts and rollback protection remain intact until reconciliation completes"
          ]
        },
        "required_receipt_fields": {
          "type": "array",
          "const": ["run_id", "profile_identity", "planner_operation_class", "planner_reason", "publication_chain", "recovery_report", "independent_truth_digest", "postconditions"]
        }
      }
    },
    "run_authorization": {
      "type": "object",
      "additionalProperties": false,
      "required": ["status", "maximum_new_end_to_end_runs", "scope", "permitted_only_if", "failure_action"],
      "properties": {
        "status": {"const": "not_executed_by_this_packet"},
        "maximum_new_end_to_end_runs": {"const": 1},
        "scope": {"const": "one fresh synthetic all-profile CK-07R1 publication/recovery run after implementation correction"},
        "permitted_only_if": {
          "type": "array",
          "const": [
            "this authority is accepted merged and exact-main verified",
            "the implementation successor starts from that exact main and touches only its authorized files",
            "the harness proves the reachable_path and append_safe_small rules without manual plan construction",
            "the independent oracle and all publication/recovery postconditions pass on the same run",
            "all five frozen budgets and the first hosted failure remain unchanged and visible",
            "no prior run identity or receipt is reused and no concurrent production run exists"
          ]
        },
        "failure_action": {"const": "retain the first new result, perform no retry, and keep CK-07R1 blocked"}
      }
    },
    "prior_attempts": {
      "type": "array",
      "minItems": 4,
      "maxItems": 4,
      "prefixItems": [
        {"const": {
          "run_id": "all-profile-initial-serializer",
          "classification": "failed_preserved",
          "profile": "all-profile",
          "timestamp_status": "output observed at local minute precision",
          "observed_at_local": "2026-08-01T15:59",
          "completed_at_local": null,
          "pid": null,
          "parent_pid": null,
          "usable_final_json": false,
          "publication_state": "none",
          "failure_or_result": "TypeError: cannot pickle mappingproxy object during receipt serialization",
          "receipt_digest": null,
          "fold_digest": null,
          "preservation": "retained_read_only_never_reused_overwritten_hidden_or_upgraded"
        }},
        {"const": {
          "run_id": "all-profile-corrected-serializer-tail-oracle",
          "classification": "failed_preserved",
          "profile": "all-profile",
          "timestamp_status": "exact process timestamps are not recoverable from current task records",
          "observed_at_local": null,
          "completed_at_local": null,
          "pid": null,
          "parent_pid": null,
          "usable_final_json": false,
          "publication_state": "temporary database cleaned",
          "failure_or_result": "independent lifecycle-fold truth omitted prior publication transitions",
          "receipt_digest": null,
          "fold_digest": null,
          "preservation": "retained_read_only_never_reused_overwritten_hidden_or_upgraded"
        }},
        {"const": {
          "run_id": "all-profile-pid-60367-recovery",
          "classification": "writer_only_not_publication_valid",
          "profile": "all-profile",
          "timestamp_status": "exact completion timestamp retained",
          "observed_at_local": null,
          "completed_at_local": "2026-08-01T16:26:43-04:00",
          "pid": 60367,
          "parent_pid": 1124,
          "usable_final_json": true,
          "publication_state": "writer_only_not_reachable_planner_recovery",
          "failure_or_result": "full JSON produced; reviewer rejected publication-valid acceptance because the harness manually forced APPEND_SAFE_SMALL and called PublicationWriter directly",
          "receipt_digest": "935e4427b93e67c5ca649b773b0b3895dafac87f49bc76d7ed8917dff2f0250d",
          "fold_digest": "19ed24f6582e135bb2a90db36d080cebab0a7735886e451bd59d87a0b75e2357",
          "preservation": "retained_read_only_never_reused_overwritten_hidden_or_upgraded"
        }},
        {"const": {
          "run_id": "production-only-valid-profile",
          "classification": "distinct_packet_required_profile",
          "profile": "production-only",
          "timestamp_status": "exact completion timestamp retained",
          "observed_at_local": null,
          "completed_at_local": "2026-08-01T15:56:26-04:00",
          "pid": null,
          "parent_pid": null,
          "usable_final_json": true,
          "publication_state": "valid_for_distinct_production_only_profile_not_all_profile",
          "failure_or_result": "five unprofiled all-time samples [18563.027, 18916.769, 19198.25, 18765.469, 18732.573] ms; max 19198.25 ms; fold digest 19ed24f6582e135bb2a90db36d080cebab0a7735886e451bd59d87a0b75e2357",
          "receipt_digest": null,
          "fold_digest": "19ed24f6582e135bb2a90db36d080cebab0a7735886e451bd59d87a0b75e2357",
          "preservation": "retained_read_only_never_reused_overwritten_hidden_or_upgraded"
        }}
      ],
      "items": false
    },
    "retained_evidence": {
      "type": "object",
      "additionalProperties": false,
      "required": ["source_path", "sha256", "dependency_sha", "branch", "status", "writer_only_receipt_digest", "fixture_digest", "implementation_sha256", "benchmark_sha256", "test_sha256"],
      "properties": {
        "source_path": {"const": "docs/decisions/evidence/ck07/publication-refresh-recovery-evidence.json"},
        "sha256": {"$ref": "#/$defs/sha256"},
        "dependency_sha": {"$ref": "#/$defs/gitSha"},
        "branch": {"const": "feature/ck-07r1-lifecycle-preparation"},
        "status": {"const": "retained_uncommitted_read_only_evidence"},
        "writer_only_receipt_digest": {"const": "935e4427b93e67c5ca649b773b0b3895dafac87f49bc76d7ed8917dff2f0250d"},
        "fixture_digest": {"$ref": "#/$defs/sha256"},
        "implementation_sha256": {"$ref": "#/$defs/sha256"},
        "benchmark_sha256": {"$ref": "#/$defs/sha256"},
        "test_sha256": {"$ref": "#/$defs/sha256"}
      }
    },
    "scope_additions": {
      "type": "array",
      "minItems": 2,
      "maxItems": 2,
      "prefixItems": [
        {"const": {
          "path": "scripts/benchmark_ck07r1_lifecycle_scale.py",
          "sha256": "d619595aa96f6edd9b22605c573cc4607d04fe2702eecd300c8cb118e3c29e3a",
          "source_of_proof": "retained CK-07R1 uncommitted diff at dependency_sha"
        }},
        {"const": {
          "path": "tests/agent_kernel/publication/test_lifecycle_scale.py",
          "sha256": "da6f9a4ed619a6753e28661065eee88ebea91de4e695e90f4954e435b5e02c8d",
          "source_of_proof": "retained CK-07R1 uncommitted diff at dependency_sha"
        }}
      ],
      "items": false
    },
    "dependencies": {
      "type": "array",
      "const": ["CK-QG1A0@eb3ded92408d9549d4a4c15c69c045cc3845689c", "CK-07R1A@4d8074952f679877f2b4fbb3e89c51015e96a197", "CK-08R0 accepted", "PR-394 retained read-only", "no CK-08R4/CK-08RG/CK-09 successor"]
    },
    "fail_closed_rules": {
      "type": "array",
      "minItems": 8,
      "items": {"type": "string"}
    }
  },
  "$defs": {
    "gitSha": {"type": "string", "pattern": "^[0-9a-f]{40}$"},
    "sha256": {"type": "string", "pattern": "^[0-9a-f]{64}$"}
  }
}
